<?xml encoding="US-ASCII"?>

<!ELEMENT  Options (Option)*> 
<!ELEMENT  Option EMPTY> 
  <!ATTLIST Option 
    	key CDATA #REQUIRED 
    	value CDATA #REQUIRED 
  > 